{
  "idField": "id",
  "idFieldValid": true,
  "readOnly": false,
  "identity": {
    "keyField": "code",
    "titleField": "name",
    "metadataFields": ["type", "mnemonic"],
    "displayLabelField": "displayLabel",
    "valid": true
  },
  "capabilities": {
    "create": true,
    "update": true,
    "delete": true,
    "options": true,
    "byId": true,
    "all": true,
    "filter": true,
    "filterExpression": false,
    "cursor": false
  }
}
